{
  "detectorModelName": "example-resource",
  "detectorModelVersion": "example-value",
  "detectorModelArn": "arn:aws:iot:us-east-1:123456789012:thing/example",
  "roleArn": "arn:aws:iot:us-east-1:123456789012:thing/example",
  "creationTime": "2025-03-15T14:30:00Z",
  "lastUpdateTime": "2025-03-15T14:30:00Z",
  "status": "ACTIVE",
  "evaluationMethod": "example-value"
}